<?xml version="1.0" encoding="UTF-8"?>
<xs:schema xmlns:xs="http://www.w3.org/2001/XMLSchema">

    <xs:element name="peliculas">
        <xs:complexType>
            <xs:sequence>
                <xs:element name="pelicula" maxOccurs="unbounded">
                    <xs:complexType>
                        <xs:sequence>
                            <xs:element name="titulo" type="xs:string"/>
                            <xs:element name="director" type="xs:string"/>
                            <xs:element name="año" type="xs:string"/>
                            <xs:element name="genero" type="xs:string"/>
                            <xs:element name="duracion" type="xs:string"/>
                            <xs:element name="puntuacion" type="xs:string"/>
                        </xs:sequence>
                        <xs:attribute name="id" type="xs:string" use="required"/>
                    </xs:complexType>
                </xs:element>
            </xs:sequence>
        </xs:complexType>
    </xs:element>

</xs:schema>